{
  "schema_version": "1.0.0",
  "record_type": "reconciliation_decision",
  "id": "resolve-review-landscape-overlap-2026-06-29",
  "created_at": "2026-06-29T00:00:00Z",
  "reconciled_by_agent": "codex",
  "reconciliation_report_id": "parallel-reconciliation-v1",
  "issue_ids": [
    "overlapping-candidate-556f590f449b"
  ],
  "issue_categories": [
    "overlapping_candidate_proposal"
  ],
  "candidate_change_ids": [
    "coverage-gap-senolytics-review-landscape-repair"
  ],
  "compatible_candidate_change_ids": [
    "coverage-gap-senolytics-review-landscape-repair"
  ],
  "resolution_status": "resolved",
  "resolution_summary": "The review-landscape repair is compatible for promotion despite sharing the senolytics coverage-assessment path because it is a reviewed no-op audit repair: it records a blocked PubMed review-landscape search, empty screening run, and preserved coverage gap without adding review-derived evidence or closing the systematic-review/meta-analysis gap. The overlapping exact-effect and registry-surveillance candidates remain active and are not accepted, applied, or superseded by this decision.",
  "evidence": [
    {
      "path": "data/candidate-changes/coverage-gap-senolytics-review-landscape-repair.json",
      "summary": "The candidate ledger is bounded to coverage-gap auditability, a research session, a search log, and an empty screening run documenting the blocked review-landscape pass."
    },
    {
      "path": "data/evidence-reviews/coverage-gap-senolytics-review-landscape-repair-extraction-fidelity.json",
      "summary": "The extraction-fidelity review accepts the candidate because it consistently records a blocked no-op search and does not add unsourced review evidence."
    },
    {
      "path": "data/evidence-reviews/coverage-gap-senolytics-review-landscape-repair-synthesis-boundary.json",
      "summary": "The synthesis-boundary review accepts the candidate because it preserves the review-landscape gap and adds no review-derived synthesis claims."
    },
    {
      "path": "data/evidence-reviews/coverage-gap-senolytics-review-landscape-repair-taxonomy-mapping.json",
      "summary": "The taxonomy-mapping review accepts the candidate's senolytics/cellular-senescence workflow scope and thin review/meta-analysis coverage category."
    },
    {
      "path": "data/candidate-changes/coverage-gap-senolytics-exact-effect-extraction-followup-2-repair.json",
      "summary": "The overlapping exact-effect candidate remains active and is not accepted, applied, or superseded by this decision."
    },
    {
      "path": "data/candidate-changes/coverage-gap-senolytics-registry-surveillance-breadth-repair.json",
      "summary": "The overlapping registry-surveillance candidate remains active and is not accepted, applied, or superseded by this decision."
    }
  ]
}
